{
  "packId": "systema-krovoobihu-bio-g8-uk",
  "title": "Кровоносна система: повторення",
  "subject": "Біологія",
  "grade": 8,
  "language": "uk",
  "objective": "Пригадати функції органів кровоносної системи людини",
  "bloom": "remember",
  "primitives": ["recall"],
  "reviewStatus": "approved",
  "approvedAt": "2026-07-09T09:10:00.000Z",
  "createdAt": "2026-07-09T08:55:00.000Z",
  "reflectionPrompt": "Яке запитання було найважчим — і що допоможе запам'ятати відповідь?",
  "items": [
    { "id": "k1", "primitive": "recall", "prompt": "Який орган працює як насос, що жене кров по тілу?", "options": ["Серце", "Печінка", "Легені", "Нирки"], "answer": 0, "difficulty": 1, "explanation": "Серце — м'язовий насос, який забезпечує рух крові по судинах.", "tags": ["серце"] },
    { "id": "k2", "primitive": "recall", "prompt": "Судини, які несуть кров ВІД серця, називаються…", "options": ["Вени", "Артерії", "Капіляри", "Нерви"], "answer": 1, "difficulty": 2, "explanation": "Артерії несуть кров від серця; вени — до серця.", "tags": ["судини"] },
    { "id": "k3", "primitive": "recall", "prompt": "Судини, які повертають кров ДО серця, — це…", "options": ["Артерії", "Капіляри", "Вени", "Аорта"], "answer": 2, "difficulty": 2, "explanation": "Вени повертають кров до серця, часто проти сили тяжіння, тому мають клапани.", "tags": ["судини"] },
    { "id": "k4", "primitive": "recall", "prompt": "Найдрібніші судини, де відбувається обмін речовин із тканинами, — це…", "options": ["Капіляри", "Вени", "Артерії", "Аорта"], "answer": 0, "difficulty": 3, "explanation": "Капіляри мають дуже тонкі стінки, крізь які кисень і поживні речовини переходять у клітини.", "tags": ["судини", "обмін"] },
    { "id": "k5", "primitive": "recall", "prompt": "Які клітини крові переносять кисень?", "options": ["Лейкоцити", "Тромбоцити", "Еритроцити", "Нейрони"], "answer": 2, "difficulty": 2, "explanation": "Еритроцити (червоні кров'яні тільця) містять гемоглобін, що зв'язує кисень.", "tags": ["кров"] },
    { "id": "k6", "primitive": "recall", "prompt": "Які клітини крові захищають організм від інфекцій?", "options": ["Еритроцити", "Лейкоцити", "Тромбоцити", "Плазма"], "answer": 1, "difficulty": 2, "explanation": "Лейкоцити (білі кров'яні тільця) — частина імунного захисту організму.", "tags": ["кров", "імунітет"] },
    { "id": "k7", "primitive": "recall", "prompt": "Що відповідає за згортання крові при пораненні?", "options": ["Еритроцити", "Тромбоцити", "Лейкоцити", "Гемоглобін"], "answer": 1, "difficulty": 3, "explanation": "Тромбоцити (кров'яні пластинки) запускають утворення тромбу, який спиняє кровотечу.", "tags": ["кров"] },
    { "id": "k8", "primitive": "recall", "prompt": "Найбільша артерія тіла людини називається…", "options": ["Аорта", "Вена", "Капіляр", "Артеріола"], "answer": 0, "difficulty": 3, "explanation": "Аорта — найбільша артерія, що виходить із лівого шлуночка серця.", "tags": ["судини", "серце"] },
    { "id": "k9", "primitive": "recall", "prompt": "Рідка частина крові, у якій рухаються клітини, — це…", "options": ["Плазма", "Гемоглобін", "Лімфа", "Сироватка"], "answer": 0, "difficulty": 3, "explanation": "Плазма — рідка складова крові (переважно вода), що переносить клітини та розчинені речовини.", "tags": ["кров"] },
    { "id": "k10", "primitive": "recall", "prompt": "Скільки камер має серце людини?", "options": ["Дві", "Три", "Чотири", "П'ять"], "answer": 2, "difficulty": 2, "explanation": "Серце людини має чотири камери: два передсердя і два шлуночки.", "tags": ["серце"] }
  ]
}
